{
    "version": "ui_plan.v1",
    "planId": "plan_lz9abc123",
    "generatedAt": "2026-01-28T10:00:00Z",
    "tenant": {
        "tenantId": "dinein",
        "venueId": null
    },
    "session": {
        "sessionKey": "sess_guest_abc123",
        "actor": {
            "actorType": "guest",
            "actorId": "anon_xyz789",
            "locale": "en-RW",
            "currency": "RWF"
        }
    },
    "screen": {
        "name": "home",
        "title": "Good evening!",
        "layout": "scroll"
    },
    "sections": [
        {
            "id": "sec_hero",
            "type": "hero",
            "title": "Welcome to DineIn",
            "subtitle": "Find your next great meal",
            "items": [
                {
                    "kind": "info",
                    "id": "greeting",
                    "primaryText": "Good evening! ðŸŒ™",
                    "secondaryText": "What are you in the mood for?"
                }
            ]
        },
        {
            "id": "sec_filters",
            "type": "chips",
            "title": null,
            "items": [
                {
                    "kind": "action",
                    "id": "filter_open",
                    "primaryText": "Open now",
                    "actionRef": "act_filter_open"
                },
                {
                    "kind": "action",
                    "id": "filter_happy",
                    "primaryText": "Happy hour",
                    "actionRef": "act_filter_happy"
                },
                {
                    "kind": "action",
                    "id": "filter_live",
                    "primaryText": "Live music",
                    "actionRef": "act_filter_live"
                }
            ]
        },
        {
            "id": "sec_top_venues",
            "type": "carousel",
            "title": "Top venues near you",
            "style": {
                "emphasis": "high"
            },
            "items": [
                {
                    "kind": "venue",
                    "id": "venue_001",
                    "primaryText": "The Hut",
                    "secondaryText": "Burgers â€¢ Pizza",
                    "meta": {
                        "ratingText": "4.8 â˜…",
                        "badge": "Popular"
                    },
                    "actionRef": "act_open_venue_001"
                },
                {
                    "kind": "venue",
                    "id": "venue_002",
                    "primaryText": "Republica",
                    "secondaryText": "Italian â€¢ Wine",
                    "meta": {
                        "ratingText": "4.6 â˜…"
                    },
                    "actionRef": "act_open_venue_002"
                }
            ]
        },
        {
            "id": "sec_offers",
            "type": "grid",
            "title": "Today's offers",
            "items": [
                {
                    "kind": "offer",
                    "id": "offer_001",
                    "primaryText": "20% off first order",
                    "secondaryText": "Valid until 9 PM",
                    "meta": {
                        "badge": "NEW"
                    },
                    "actionRef": "act_offer_001"
                },
                {
                    "kind": "offer",
                    "id": "offer_002",
                    "primaryText": "Free dessert",
                    "secondaryText": "Orders over 15,000 RWF",
                    "actionRef": "act_offer_002"
                }
            ]
        }
    ],
    "actions": {
        "byId": {
            "act_filter_open": {
                "intent": "applyFilter",
                "params": {
                    "filters": {
                        "isOpen": true
                    }
                }
            },
            "act_filter_happy": {
                "intent": "applyFilter",
                "params": {
                    "filters": {
                        "hasHappyHour": true
                    }
                }
            },
            "act_filter_live": {
                "intent": "applyFilter",
                "params": {
                    "filters": {
                        "hasLiveMusic": true
                    }
                }
            },
            "act_open_venue_001": {
                "intent": "openVenue",
                "params": {
                    "venueId": "venue_001"
                }
            },
            "act_open_venue_002": {
                "intent": "openVenue",
                "params": {
                    "venueId": "venue_002"
                }
            },
            "act_offer_001": {
                "intent": "openVenue",
                "params": {
                    "venueId": "venue_001",
                    "referrer": "offer"
                }
            },
            "act_offer_002": {
                "intent": "openVenue",
                "params": {
                    "venueId": "venue_002",
                    "referrer": "offer"
                }
            }
        }
    },
    "cache": {
        "ttlSeconds": 300,
        "varyBy": [
            "locale",
            "guestProfile"
        ]
    },
    "debug": {
        "explanation": "Home screen for anonymous guest in Rwanda",
        "sourceToolCalls": [
            {
                "tool": "venues.list_nearby",
                "correlationId": "corr_lz9a01"
            },
            {
                "tool": "offers.list_applicable",
                "correlationId": "corr_lz9a02"
            }
        ]
    }
}